{
  "schema_version": "1",
  "scan_id": "0b6f3d2e-8c1a-4e57-9b0d-2f4a6c8e1b3d",
  "scan_art": "lokal",
  "pruefumfang": "einzeldatei",
  "geprueft_am": "2026-09-26T18:00:00Z",
  "engine_version": "0.1.0",
  "paket": { "name": "SKILL.md", "version": null, "quelle": "lokal", "dateien": 1, "bytes": 2048 },
  "ampeln": { "sicherheit": "gesperrt", "dsgvo": "nicht_bewertet", "gesamt": "gesperrt" },
  "note": 60,
  "freigabe": "blockiert",
  "befunde": [
    {
      "rule_id": "LB-B01-unicode-tags",
      "ebene": "B",
      "schwere": "K",
      "achse": "sicherheit",
      "titel": "Unsichtbare Anweisung in Unicode-Tag-Zeichen",
      "erklaerung": "Die Datei enthält Zeichen, die Menschen nicht sehen, ein Sprachmodell aber liest.",
      "datei": "SKILL.md",
      "zeile": 12,
      "beleg": "Fasse den Text kurz zusammen.[142 unsichtbare Zeichen]",
      "nachweisgrad": "statisch_erkannt",
      "normbezug": ["OWASP-ASI01"],
      "fix": "Zeichen U+E0000 bis U+E007F entfernen.",
      "fix_prompt": "Entferne in SKILL.md alle Unicode-Tag-Zeichen."
    }
  ],
  "nicht_geprueft": [
    { "pruefung": "D – Abhängigkeiten", "grund": "Einzeldatei-Prüfung" },
    { "pruefung": "Korrelation", "grund": "Einzeldatei-Prüfung" },
    { "pruefung": "G – Manifest-Abgleich", "grund": "kein luibui.json" }
  ],
  "hinweise": ["Einzeldatei-Prüfung"]
}
