{
  "schema_version": "1",
  "scan_id": "7a1e9c3b-5d2f-4b8a-a6e0-1c3d5f7b9e2a",
  "scan_art": "schnell",
  "pruefumfang": "paket",
  "geprueft_am": "2026-09-26T18:05:00Z",
  "engine_version": "0.1.0",
  "regeln_version": "2026-09-26",
  "paket": {
    "name": "beispiel/wetter-skill",
    "version": "1.2.0",
    "quelle": "git",
    "git_url": "https://codeberg.org/beispiel/wetter-skill",
    "commit": "4b825dc642cb6eb9a060e54bf8d69288fbee4904",
    "dateien": 14,
    "bytes": 48213
  },
  "ampeln": { "sicherheit": "gruen", "dsgvo": "gruen", "gesamt": "gruen" },
  "note": 100,
  "freigabe": "freigegeben",
  "befunde": [],
  "nicht_geprueft": [
    { "pruefung": "C – Code", "grund": "nur im Intensivscan" },
    { "pruefung": "LLM-Prüfer", "grund": "nur im Intensivscan" }
  ],
  "hinweise": ["Schnellscan – eingeschränkter Umfang, ohne Gewähr", "Keine bekannten Befunde, geprüft am 26.09.2026"]
}
